{"clean":true,"findings":[],"inputs":[{"bytes":7014,"label":"browser/host.js","sha256":"79d39769540f98530fec31565c020679fd4a8833855edc323fd6f9bd63b7f685"},{"bytes":455,"label":"browser/index.html","sha256":"482575b9c80f3dcc7bde803a15cf1c0615a955885a3223a4e9dee418ec7b3405"},{"bytes":2320,"label":"bundle/Elixir.AVMPort.beam","sha256":"616db3056307f7e0ccb5e21a88b553b0aee995129c4194e6268aed6610887ba8"},{"bytes":31004,"label":"bundle/Elixir.Access.beam","sha256":"74d236adbe9e7f1c8592c634111f1d9749477fd452498e2f3822d5995e1d4989"},{"bytes":5248,"label":"bundle/Elixir.Agent.Server.beam","sha256":"dc6f6953882aa561cb4284a357a771f38b12c7eb84147c5e8dc8e844eb6af0d7"},{"bytes":12192,"label":"bundle/Elixir.Agent.beam","sha256":"d6fdecb7a3bc7e68c483c907366a314cefe1942b26ec8a8f6e26398292d486c6"},{"bytes":30612,"label":"bundle/Elixir.Application.beam","sha256":"01b4dba75acc294ffd6deb5c706978e22700de54f2db0fd9b3d56e487104bd49"},{"bytes":4060,"label":"bundle/Elixir.ArgumentError.beam","sha256":"6c705376e79a5d868b55990905013047a269d043117832ed3aa0291312e3c2ab"},{"bytes":6108,"label":"bundle/Elixir.ArithmeticError.beam","sha256":"52a98d6667e8f28865c4fc19aee8970b6835c96f3338c6ad81e59e90d847a80f"},{"bytes":2668,"label":"bundle/Elixir.Atom.beam","sha256":"c9278bdb2b232278e89a627986d5b5db6784b31387e98f0b5867ec4e45d73891"},{"bytes":5264,"label":"bundle/Elixir.BadArityError.beam","sha256":"002e4a373ec726f3d7a0cb84e7359b111a1797286373a116cbe78f949bb0fcc6"},{"bytes":4396,"label":"bundle/Elixir.BadBooleanError.beam","sha256":"4b876faa4621441a708df968db2709a24a84e357d4ec5eb0b6455098a06b9cb9"},{"bytes":4316,"label":"bundle/Elixir.BadFunctionError.beam","sha256":"ed80fcd91b2147e45e4108235c85feb984b42b6c5b5e7d6a5b8d3b2dd923d084"},{"bytes":4064,"label":"bundle/Elixir.BadMapError.beam","sha256":"d7c8096c3ba759670fbc48a3a092ef8df4bcca0675032bf2e4ba38d675bac3d3"},{"bytes":4176,"label":"bundle/Elixir.BadStructError.beam","sha256":"3eda83862b167cf5e92bd6aa2210282555be1b0e181ba034f5e8a5d535983bfe"},{"bytes":130748,"label":"bundle/Elixir.Base.beam","sha256":"a2f74d5048ddfa865875d5b4cf24a427f4170dbd307444944f5b0e300e4a68c8"},{"bytes":6036,"label":"bundle/Elixir.Behaviour.beam","sha256":"534d77b72ab5550f0a3eba257e490ddc01ed28409cf6ce8d8c81853862e03b0a"},{"bytes":5096,"label":"bundle/Elixir.Bitwise.beam","sha256":"1de8bea574cae0d3e3c481b07ccc5b7c561b3e8d68cc2f51b33fb94cdfb1ac6c"},{"bytes":11748,"label":"bundle/Elixir.BlazeX.BH06.VerticalSlice.Boot.beam","sha256":"d53b69fe740928128239bd94e13dec6a74003e46eab319e03942042789625eac"},{"bytes":7632,"label":"bundle/Elixir.BlazeX.BH06.VerticalSlice.Browser.beam","sha256":"01da1c05ccb832864255c4cec65ee9f8f07a7e4ab396b877761173e13f823be7"},{"bytes":7592,"label":"bundle/Elixir.BlazeX.BH06.VerticalSlice.Counter.beam","sha256":"84a8231273ad4e1c29874444003e322148351e36319b616913291965e287df7f"},{"bytes":19688,"label":"bundle/Elixir.BlazeX.Component.Action.beam","sha256":"b45b509148f858003a2657ff48f3d67a92ca6e2313bb5502b3e47fb93707fccc"},{"bytes":50584,"label":"bundle/Elixir.BlazeX.Component.ActionLedger.beam","sha256":"a6a9f8e56d791c2e65b2972bd44d454c47b8442aa90fcf15b5e47f77b51b17b5"},{"bytes":12536,"label":"bundle/Elixir.BlazeX.Component.ActionManifest.beam","sha256":"2fb4939f460cffc4fd92fbccaa0b17f9e60075baa24d1d5ae738ba73732b00c9"},{"bytes":3696,"label":"bundle/Elixir.BlazeX.Component.ActionPort.beam","sha256":"019fc6de81ac2021b8c626e18152743c12919cea24a16e1b3972ec877fc05a8c"},{"bytes":36768,"label":"bundle/Elixir.BlazeX.Component.ActionRuntime.beam","sha256":"fd9123d511fd17151c08b2766d901712dcdcc3f37e960cfb71e877d2f12bfc41"},{"bytes":2492,"label":"bundle/Elixir.BlazeX.Component.ActionView.beam","sha256":"238d20bc25c3b2dd660c83be4222d6904a7d0474976399f630d5ba766da26ca5"},{"bytes":30924,"label":"bundle/Elixir.BlazeX.Component.CleanupOutcome.beam","sha256":"08771eaa7ffe24f74584cc0b98ef52ee5d891e774f78b9c7735334a64b5d5a33"},{"bytes":16144,"label":"bundle/Elixir.BlazeX.Component.ComponentRegistry.beam","sha256":"bc610b88af3009ef5df0848d571bd6a89b717a3ea43671934f55b820fc4cc777"},{"bytes":5756,"label":"bundle/Elixir.BlazeX.Component.Contract.beam","sha256":"ba0c2065d47bafa69792c1effab3039a0cf232aad5a2dee112fa798d8f3d9b40"},{"bytes":12460,"label":"bundle/Elixir.BlazeX.Component.Input.beam","sha256":"51496a1e83a110834dacceef4e9b6ef76ecd8c89c9f6893bfea00b0407cdd20b"},{"bytes":5036,"label":"bundle/Elixir.BlazeX.Component.Invocation.beam","sha256":"3dd626f3fb5bcad41d04ad0469fff91210db40c6a712beb8e21c8998d34abdbc"},{"bytes":3276,"label":"bundle/Elixir.BlazeX.Component.LocalView.Supervisor.beam","sha256":"0dc20900a1d8ba0bdb1efdc46c9688874a79c7a1b2382c8f806fd2fee64130b0"},{"bytes":13816,"label":"bundle/Elixir.BlazeX.Component.LocalView.beam","sha256":"dec900a8303a65cdde97e521f768a3915e5285c4f2c62a3cf379cd613a8cf8f4"},{"bytes":16288,"label":"bundle/Elixir.BlazeX.Component.NestedTable.beam","sha256":"4157e983b32987b598450fb57ae568b2aa590929dc6e140cdeb0b5c8f1fe87b8"},{"bytes":12972,"label":"bundle/Elixir.BlazeX.Component.Props.beam","sha256":"24f1fcd346ccd1a74ae8231ec0720dc5fdaf986e1ddcf4ae8972e3c27583da7d"},{"bytes":1724,"label":"bundle/Elixir.BlazeX.Component.Pure.beam","sha256":"a442c84adcc3b9696b17d4ac865c35303c6c7d4d18f1f3abb0d7483d55eb8591"},{"bytes":44700,"label":"bundle/Elixir.BlazeX.Component.RecoveryCleanup.beam","sha256":"70978b4d80d256b924860226b6a87a0db668c0a083cf437001d5ef2b9decf050"},{"bytes":32684,"label":"bundle/Elixir.BlazeX.Component.RecoveryGuardian.beam","sha256":"9c1b9385528a4dafca4014783353de8d9f7f97af73fc0e4614980fb462d47dd1"},{"bytes":12840,"label":"bundle/Elixir.BlazeX.Component.RecoveryPolicy.beam","sha256":"67e212060e9143c37911de446e145439d0b415fb21b0ab8845056de513c04ba5"},{"bytes":62740,"label":"bundle/Elixir.BlazeX.Component.RecoveryPort.beam","sha256":"4122f400ff4833b295d89171f73354b2afb50f14e17e6110bcc6f693856a872a"},{"bytes":9712,"label":"bundle/Elixir.BlazeX.Component.RecoveryRuntime.beam","sha256":"7d3a798abb375cc4ff2850dedbbd7104c89e91bf65ab4fed33a6d2c0184b29e1"},{"bytes":2924,"label":"bundle/Elixir.BlazeX.Component.RecoveryView.beam","sha256":"9b3484a5ae8ee92dbb9298f4300bf222cd7e727c54e39c088d8fa2d8aee6fee8"},{"bytes":7324,"label":"bundle/Elixir.BlazeX.Component.ReleaseTicket.beam","sha256":"b1abdfea684cf66ced55cec64a75dc801267e6132b4cafa2ccf35952513f5363"},{"bytes":5952,"label":"bundle/Elixir.BlazeX.Component.Result.beam","sha256":"a53067f937989b855179f7d13d3888131857142c9bcf5ea80f1812e4b6a49aff"},{"bytes":2388,"label":"bundle/Elixir.BlazeX.Component.Root.beam","sha256":"578e2713f3a435a1c71ec7b45fab10aa2139ff3e13d2a360bc72045bb1a6063a"},{"bytes":19884,"label":"bundle/Elixir.BlazeX.Component.RootGuardian.beam","sha256":"dc7bcd630b9a90fdbb833fbbe5dcb24327f0209fa25753c1f8d166b1f87381ca"},{"bytes":1948,"label":"bundle/Elixir.BlazeX.Component.RootPort.Evaluator.beam","sha256":"d62e55cef56f2cb764eed3ee8d644404e429b3c3361ff10f33a149c0df02e053"},{"bytes":1784,"label":"bundle/Elixir.BlazeX.Component.RootPort.Host.beam","sha256":"9249926d86150f21093dc1f05f5af2e58b749be3d84061c55fd50b5440ac4bfc"},{"bytes":1888,"label":"bundle/Elixir.BlazeX.Component.RootPort.Renderer.beam","sha256":"7b761a27e8701f021d7630c5c07be85ed0e676d96e4728813c7787bb01ed9b1c"},{"bytes":29424,"label":"bundle/Elixir.BlazeX.Component.RootPort.beam","sha256":"2f654580dee0784db8a439491f5c622b5fd2081d752b5c14ac091e1b6d2d5f68"},{"bytes":70984,"label":"bundle/Elixir.BlazeX.Component.RootProcess.beam","sha256":"b876818d0b1b80e97ba80921a1bf3d17b3964818ad243231db868625740f54e5"},{"bytes":43852,"label":"bundle/Elixir.BlazeX.Component.RootSchedule.beam","sha256":"6f36418a3e588e9d0d676d4a52ac01fa8e9d740cf2d7e9ac92c425ecb77f4924"},{"bytes":19652,"label":"bundle/Elixir.BlazeX.Component.RootTimers.beam","sha256":"714222e38da9634c35a175e6c49118c6f8522115e87934f94579e0e561430b62"},{"bytes":4740,"label":"bundle/Elixir.BlazeX.Component.ScheduledView.beam","sha256":"e4a59523b02c7b72214d2b3a188d92baa5d13039071cdd8ed1d6bf038300d631"},{"bytes":8368,"label":"bundle/Elixir.BlazeX.Component.SchedulingIntents.beam","sha256":"c78ca0fdbb13bc93f7b5f5676ab07cbb686758c267552f7fc7f250de076483d0"},{"bytes":3228,"label":"bundle/Elixir.BlazeX.Component.SchedulingPort.beam","sha256":"ac3ea4e8faf8a58befaafbf67376a2261f860aa25ca9b90cf488cefbe9b5e744"},{"bytes":19252,"label":"bundle/Elixir.BlazeX.Component.Schema.beam","sha256":"32b4d6c709c1fde9ce45dfffe5e96730fd1ed50614ac3b8dfd553b33762a7983"},{"bytes":30888,"label":"bundle/Elixir.BlazeX.Component.ScopedContext.beam","sha256":"dcde262096ec453997e7abf5131c981238e79d8ab851b97591ec4bd5ab49d8bd"},{"bytes":6576,"label":"bundle/Elixir.BlazeX.Component.ScopedView.beam","sha256":"c5ab59e481dae49b5e532918e381bcf301e77c2f81754b02129dafaf0facfbc6"},{"bytes":13632,"label":"bundle/Elixir.BlazeX.Component.Slots.beam","sha256":"fe3ccee2eee27a99a7b87b2ed91384c552d2296292ba3fe30f7de7593a92ac14"},{"bytes":2168,"label":"bundle/Elixir.BlazeX.Component.Stateful.beam","sha256":"98bd24e2a77bd44ee98f046eb13ac98026da8caddb81ef17aeaae060388e094e"},{"bytes":1952,"label":"bundle/Elixir.BlazeX.Component.beam","sha256":"474e231b1fc0870870dcedf4c5c8bfcc8f4f70c73f0068554224a3b7a8964b9d"},{"bytes":15848,"label":"bundle/Elixir.BlazeX.Core.Authoring.beam","sha256":"9d22ad31a703ba3f3088ee9ef8e00f74fe6b82907de5607a85bbd4bfc5434507"},{"bytes":2516,"label":"bundle/Elixir.BlazeX.Core.Component.beam","sha256":"02a074370759698c9946a65508a9eec9c8460709df3b2199ca4b666b07ff223e"},{"bytes":3608,"label":"bundle/Elixir.BlazeX.Core.Context.beam","sha256":"d223ce4e0605723b725770b6ca48619efc33553ad5e583ac134942ced8611407"},{"bytes":3928,"label":"bundle/Elixir.BlazeX.Core.Diagnostic.beam","sha256":"6f69c5c1e3bf638cb87832044084adde82a1bacb221ae4fd9fea752408e37330"},{"bytes":4032,"label":"bundle/Elixir.BlazeX.Core.Evaluation.beam","sha256":"fbd2a6d53c22e81ca5adeb4d20269036eb2a222e1796889476f7d9afd895309c"},{"bytes":21452,"label":"bundle/Elixir.BlazeX.Core.Evaluator.beam","sha256":"8562b5611f5b328735d1fd61003b878ea2e42d93543e74f972a8dcb802bdc682"},{"bytes":10932,"label":"bundle